{
  "profile_schema_version": "1.0",
  "profile_type": "archon-interface",
  "adapter": "archon-keymaster",
  "enabled": false,
  "network_access": false,
  "allow_writes": false,
  "allow_payments": false,
  "node_url": "https://4tress.org",
  "requested_registry": "hyperswarm",
  "python_requirement": ">=3.12",
  "client_distribution": "archon-keymaster",
  "client_source_version": "0.7.0",
  "client_source_revision": "0a6ecf574a6a35175471a3342e30936336f37df6",
  "client_source_subdirectory": "python/keymaster",
  "wallet_root": "runs/private/archon",
  "max_concurrent_requests": 1,
  "max_requests_per_second": 0.5,
  "max_total_requests": 25,
  "max_synthetic_dids": 2,
  "max_public_claim_assets": 6,
  "operation_timeout_seconds": 45,
  "max_read_retries": 1,
  "max_write_retries": 0,
  "independent_node_url": null,
  "live_preflight_status": "not_verified"
}
